{
  "year": 2014,
  "sources": [
    "tpe"
  ],
  "summary": {
    "total": 365,
    "workdays": 252,
    "holidays": 113
  },
  "days": [
    {
      "date": "2014-01-01",
      "weekday": 3,
      "isWorkday": false,
      "name": "中華民國開國紀念日",
      "category": "放假之紀念日及節日",
      "description": "全國各機關學校放假一日。"
    },
    {
      "date": "2014-01-02",
      "weekday": 4,
      "isWorkday": true,
      "name": "",
      "category": "",
      "description": ""
    },
    {
      "date": "2014-01-03",
      "weekday": 5,
      "isWorkday": true,
      "name": "",
      "category": "",
      "description": ""
    },
    {
      "date": "2014-01-04",
      "weekday": 6,
      "isWorkday": false,
      "name": "",
      "category": "星期六、星期日",
      "description": ""
    },
    {
      "date": "2014-01-05",
      "weekday": 7,
      "isWorkday": false,
      "name": "",
      "category": "星期六、星期日",
      "description": ""
    },
    {
      "date": "2014-01-06",
      "weekday": 1,
      "isWorkday": true,
      "name": "",
      "category": "",
      "description": ""
    },
    {
      "date": "2014-01-07",
      "weekday": 2,
      "isWorkday": true,
      "name": "",
      "category": "",
      "description": ""
    },
    {
      "date": "2014-01-08",
      "weekday": 3,
      "isWorkday": true,
      "name": "",
      "category": "",
      "description": ""
    },
    {
      "date": "2014-01-09",
      "weekday": 4,
      "isWorkday": true,
      "name": "",
      "category": "",
      "description": ""
    },
    {
      "date": "2014-01-10",
      "weekday": 5,
      "isWorkday": true,
      "name": "",
      "category": "",
      "description": ""
    },
    {
      "date": "2014-01-11",
      "weekday": 6,
      "isWorkday": false,
      "name": "",
      "category": "星期六、星期日",
      "description": ""
    },
    {
      "date": "2014-01-12",
      "weekday": 7,
      "isWorkday": false,
      "name": "",
      "category": "星期六、星期日",
      "description": ""
    },
    {
      "date": "2014-01-13",
      "weekday": 1,
      "isWorkday": true,
      "name": "",
      "category": "",
      "description": ""
    },
    {
      "date": "2014-01-14",
      "weekday": 2,
      "isWorkday": true,
      "name": "",
      "category": "",
      "description": ""
    },
    {
      "date": "2014-01-15",
      "weekday": 3,
      "isWorkday": true,
      "name": "",
      "category": "",
      "description": ""
    },
    {
      "date": "2014-01-16",
      "weekday": 4,
      "isWorkday": true,
      "name": "",
      "category": "",
      "description": ""
    },
    {
      "date": "2014-01-17",
      "weekday": 5,
      "isWorkday": true,
      "name": "",
      "category": "",
      "description": ""
    },
    {
      "date": "2014-01-18",
      "weekday": 6,
      "isWorkday": false,
      "name": "",
      "category": "星期六、星期日",
      "description": ""
    },
    {
      "date": "2014-01-19",
      "weekday": 7,
      "isWorkday": false,
      "name": "",
      "category": "星期六、星期日",
      "description": ""
    },
    {
      "date": "2014-01-20",
      "weekday": 1,
      "isWorkday": true,
      "name": "",
      "category": "",
      "description": ""
    },
    {
      "date": "2014-01-21",
      "weekday": 2,
      "isWorkday": true,
      "name": "",
      "category": "",
      "description": ""
    },
    {
      "date": "2014-01-22",
      "weekday": 3,
      "isWorkday": true,
      "name": "",
      "category": "",
      "description": ""
    },
    {
      "date": "2014-01-23",
      "weekday": 4,
      "isWorkday": true,
      "name": "",
      "category": "",
      "description": ""
    },
    {
      "date": "2014-01-24",
      "weekday": 5,
      "isWorkday": true,
      "name": "",
      "category": "",
      "description": ""
    },
    {
      "date": "2014-01-25",
      "weekday": 6,
      "isWorkday": false,
      "name": "",
      "category": "星期六、星期日",
      "description": ""
    },
    {
      "date": "2014-01-26",
      "weekday": 7,
      "isWorkday": false,
      "name": "",
      "category": "星期六、星期日",
      "description": ""
    },
    {
      "date": "2014-01-27",
      "weekday": 1,
      "isWorkday": true,
      "name": "",
      "category": "",
      "description": ""
    },
    {
      "date": "2014-01-28",
      "weekday": 2,
      "isWorkday": true,
      "name": "",
      "category": "",
      "description": ""
    },
    {
      "date": "2014-01-29",
      "weekday": 3,
      "isWorkday": true,
      "name": "",
      "category": "",
      "description": ""
    },
    {
      "date": "2014-01-30",
      "weekday": 4,
      "isWorkday": false,
      "name": "農曆除夕",
      "category": "放假之紀念日及節日",
      "description": "全國各機關學校放假一日。"
    },
    {
      "date": "2014-01-31",
      "weekday": 5,
      "isWorkday": false,
      "name": "春節",
      "category": "放假之紀念日及節日",
      "description": "全國各機關學校於一月三十一日至二月二日放假三日，二月一日及二月二日適逢星期六、星期日，分別於二月三日及二月四日補假一日。"
    },
    {
      "date": "2014-02-01",
      "weekday": 6,
      "isWorkday": false,
      "name": "春節",
      "category": "放假之紀念日及節日",
      "description": "全國各機關學校於一月三十一日至二月二日放假三日，二月一日及二月二日適逢星期六、星期日，分別於二月三日及二月四日補假一日。"
    },
    {
      "date": "2014-02-02",
      "weekday": 7,
      "isWorkday": false,
      "name": "春節",
      "category": "放假之紀念日及節日",
      "description": "全國各機關學校於一月三十一日至二月二日放假三日，二月一日及二月二日適逢星期六、星期日，分別於二月三日及二月四日補假一日。"
    },
    {
      "date": "2014-02-03",
      "weekday": 1,
      "isWorkday": false,
      "name": "",
      "category": "補假",
      "description": ""
    },
    {
      "date": "2014-02-04",
      "weekday": 2,
      "isWorkday": false,
      "name": "",
      "category": "補假",
      "description": ""
    },
    {
      "date": "2014-02-05",
      "weekday": 3,
      "isWorkday": true,
      "name": "",
      "category": "",
      "description": ""
    },
    {
      "date": "2014-02-06",
      "weekday": 4,
      "isWorkday": true,
      "name": "",
      "category": "",
      "description": ""
    },
    {
      "date": "2014-02-07",
      "weekday": 5,
      "isWorkday": true,
      "name": "",
      "category": "",
      "description": ""
    },
    {
      "date": "2014-02-08",
      "weekday": 6,
      "isWorkday": false,
      "name": "",
      "category": "星期六、星期日",
      "description": ""
    },
    {
      "date": "2014-02-09",
      "weekday": 7,
      "isWorkday": false,
      "name": "",
      "category": "星期六、星期日",
      "description": ""
    },
    {
      "date": "2014-02-10",
      "weekday": 1,
      "isWorkday": true,
      "name": "",
      "category": "",
      "description": ""
    },
    {
      "date": "2014-02-11",
      "weekday": 2,
      "isWorkday": true,
      "name": "",
      "category": "",
      "description": ""
    },
    {
      "date": "2014-02-12",
      "weekday": 3,
      "isWorkday": true,
      "name": "",
      "category": "",
      "description": ""
    },
    {
      "date": "2014-02-13",
      "weekday": 4,
      "isWorkday": true,
      "name": "",
      "category": "",
      "description": ""
    },
    {
      "date": "2014-02-14",
      "weekday": 5,
      "isWorkday": true,
      "name": "",
      "category": "",
      "description": ""
    },
    {
      "date": "2014-02-15",
      "weekday": 6,
      "isWorkday": false,
      "name": "",
      "category": "星期六、星期日",
      "description": ""
    },
    {
      "date": "2014-02-16",
      "weekday": 7,
      "isWorkday": false,
      "name": "",
      "category": "星期六、星期日",
      "description": ""
    },
    {
      "date": "2014-02-17",
      "weekday": 1,
      "isWorkday": true,
      "name": "",
      "category": "",
      "description": ""
    },
    {
      "date": "2014-02-18",
      "weekday": 2,
      "isWorkday": true,
      "name": "",
      "category": "",
      "description": ""
    },
    {
      "date": "2014-02-19",
      "weekday": 3,
      "isWorkday": true,
      "name": "",
      "category": "",
      "description": ""
    },
    {
      "date": "2014-02-20",
      "weekday": 4,
      "isWorkday": true,
      "name": "",
      "category": "",
      "description": ""
    },
    {
      "date": "2014-02-21",
      "weekday": 5,
      "isWorkday": true,
      "name": "",
      "category": "",
      "description": ""
    },
    {
      "date": "2014-02-22",
      "weekday": 6,
      "isWorkday": false,
      "name": "",
      "category": "星期六、星期日",
      "description": ""
    },
    {
      "date": "2014-02-23",
      "weekday": 7,
      "isWorkday": false,
      "name": "",
      "category": "星期六、星期日",
      "description": ""
    },
    {
      "date": "2014-02-24",
      "weekday": 1,
      "isWorkday": true,
      "name": "",
      "category": "",
      "description": ""
    },
    {
      "date": "2014-02-25",
      "weekday": 2,
      "isWorkday": true,
      "name": "",
      "category": "",
      "description": ""
    },
    {
      "date": "2014-02-26",
      "weekday": 3,
      "isWorkday": true,
      "name": "",
      "category": "",
      "description": ""
    },
    {
      "date": "2014-02-27",
      "weekday": 4,
      "isWorkday": true,
      "name": "",
      "category": "",
      "description": ""
    },
    {
      "date": "2014-02-28",
      "weekday": 5,
      "isWorkday": false,
      "name": "和平紀念日",
      "category": "放假之紀念日及節日",
      "description": "全國各機關學校放假一日。"
    },
    {
      "date": "2014-03-01",
      "weekday": 6,
      "isWorkday": false,
      "name": "",
      "category": "星期六、星期日",
      "description": ""
    },
    {
      "date": "2014-03-02",
      "weekday": 7,
      "isWorkday": false,
      "name": "",
      "category": "星期六、星期日",
      "description": ""
    },
    {
      "date": "2014-03-03",
      "weekday": 1,
      "isWorkday": true,
      "name": "",
      "category": "",
      "description": ""
    },
    {
      "date": "2014-03-04",
      "weekday": 2,
      "isWorkday": true,
      "name": "",
      "category": "",